{
  "id": "aaaaaaaa-bbbb-cccc-dddd-0000000000a1",
  "house_id": "aaaaaaaa-bbbb-cccc-dddd-000000000001",
  "company": "圣都整装",
  "package_name": "AEs",
  "version": "2025-brochure",
  "billing_area_sqm": 76.34,
  "sales_area_sqm": 90,
  "source": "seed",
  "costs": {
    "hard_base": 65000,
    "overage_unit": 699,
    "overage_area": 26.34,
    "overage_fee": 18411.66,
    "hard_subtotal": 83411.66,
    "custom_particle": 13000,
    "custom_solid": 16000,
    "base_particle": 96411.66,
    "base_solid": 99411.66,
    "mgmt_fee": 10009.4,
    "pm_fee": 1668.23,
    "total_particle": 108089.29,
    "total_solid": 111089.29,
    "currency": "CNY"
  },
  "notes": ["不含拆改/个性化设计/现场木作", "管理费基数以合同为准", "报价按计价面积"],
  "line_items": [
    {"space": "客餐厅", "category": "地砖+踢脚线", "spec": "马可波罗/东鹏/欧神诺/蒙娜丽莎", "brands": ["马可波罗", "东鹏", "欧神诺", "蒙娜丽莎"], "term_slugs": ["billing-area"]},
    {"space": "客餐厅", "category": "腻子基层", "spec": "东方雨虹", "brands": ["东方雨虹"], "term_slugs": ["putty-base"]},
    {"space": "客餐厅", "category": "乳胶漆", "spec": "多乐士/嘉宝莉", "brands": ["多乐士", "嘉宝莉"], "term_slugs": []},
    {"space": "客餐厅", "category": "入户/门套", "spec": "升升概念/江山欧派/派的门", "brands": ["升升概念", "江山欧派", "派的门"], "term_slugs": ["door-casing"]},
    {"space": "客餐厅", "category": "窗台石", "spec": "天然石/人造石/岩板", "brands": [], "term_slugs": []},
    {"space": "客餐厅", "category": "强电电线", "spec": "中大元通/东方电缆", "brands": ["中大元通", "东方电缆"], "term_slugs": ["power-wiring"]},
    {"space": "客餐厅", "category": "弱电电线", "spec": "永鼎", "brands": ["永鼎"], "term_slugs": ["weak-current"]},
    {"space": "客餐厅", "category": "线管底盒", "spec": "伟星/日丰/公元", "brands": ["伟星", "日丰", "公元"], "term_slugs": ["ppr-pipe"]},
    {"space": "客餐厅", "category": "开关插座", "spec": "西门子", "brands": ["西门子"], "term_slugs": []},
    {"space": "客餐厅", "category": "全屋定制品牌", "spec": "志邦/金牌/莫干山/兔宝宝", "brands": ["志邦", "金牌", "莫干山", "兔宝宝"], "term_slugs": ["custom-cabinetry", "particle-board"]},
    {"space": "厨房", "category": "地砖墙砖", "spec": "马可波罗/东鹏/欧神诺/蒙娜丽莎", "brands": ["马可波罗", "东鹏", "欧神诺", "蒙娜丽莎"], "term_slugs": []},
    {"space": "厨房", "category": "集成吊顶+电器", "spec": "奥普/美的", "brands": ["奥普", "美的"], "term_slugs": ["integrated-ceiling"]},
    {"space": "厨房", "category": "橱柜", "spec": "金牌（约3m地柜+1.5m吊柜）", "brands": ["金牌"], "term_slugs": ["custom-cabinetry"]},
    {"space": "厨房", "category": "台面", "spec": "厨之宝/欧铂利", "brands": ["厨之宝", "欧铂利"], "term_slugs": []},
    {"space": "厨房", "category": "水槽+龙头", "spec": "欧琳/诺帝玛", "brands": ["欧琳", "诺帝玛"], "term_slugs": []},
    {"space": "厨房", "category": "金属移门", "spec": "卡帝/德诺克", "brands": ["卡帝", "德诺克"], "term_slugs": []},
    {"space": "厨房", "category": "门套", "spec": "升升概念/江山欧派/派的门", "brands": ["升升概念", "江山欧派", "派的门"], "term_slugs": ["door-casing"]},
    {"space": "卧室", "category": "复合地板+踢脚线", "spec": "德尔/莫干山/书香门地", "brands": ["德尔", "莫干山", "书香门地"], "term_slugs": ["skirting"]},
    {"space": "卧室", "category": "木开门+五金", "spec": "升升概念/派的门/江山欧派", "brands": ["升升概念", "派的门", "江山欧派"], "term_slugs": ["door-casing"]},
    {"space": "卧室", "category": "腻子/乳胶漆", "spec": "东方雨虹 + 多乐士/嘉宝莉", "brands": ["东方雨虹", "多乐士", "嘉宝莉"], "term_slugs": ["putty-base"]},
    {"space": "阳台", "category": "地砖+踢脚线", "spec": "马可波罗/东鹏/欧神诺/蒙娜丽莎", "brands": ["马可波罗", "东鹏", "欧神诺", "蒙娜丽莎"], "term_slugs": []},
    {"space": "阳台", "category": "专业防水", "spec": "东方雨虹", "brands": ["东方雨虹"], "term_slugs": ["waterproofing"]},
    {"space": "阳台", "category": "地漏", "spec": "潜水艇", "brands": ["潜水艇"], "term_slugs": []},
    {"space": "卫生间", "category": "地砖墙砖", "spec": "马可波罗/东鹏/欧神诺/蒙娜丽莎", "brands": ["马可波罗", "东鹏", "欧神诺", "蒙娜丽莎"], "term_slugs": []},
    {"space": "卫生间", "category": "专业防水", "spec": "东方雨虹", "brands": ["东方雨虹"], "term_slugs": ["waterproofing"]},
    {"space": "卫生间", "category": "集成吊顶+电器", "spec": "奥普/美的", "brands": ["奥普", "美的"], "term_slugs": ["integrated-ceiling"]},
    {"space": "卫生间", "category": "浴室柜/龙头/马桶/花洒", "spec": "九牧/箭牌/惠达", "brands": ["九牧", "箭牌", "惠达"], "term_slugs": []},
    {"space": "卫生间", "category": "淋浴房", "spec": "宣传页本段未明确单列", "brands": [], "term_slugs": ["shower-enclosure"]},
    {"space": "卫生间", "category": "木门", "spec": "升升概念/江山欧派/派的门", "brands": ["升升概念", "江山欧派", "派的门"], "term_slugs": ["door-casing"]},
    {"space": "辅材", "category": "给水管PPR", "spec": "伟星/日丰/公元", "brands": ["伟星", "日丰", "公元"], "term_slugs": ["ppr-pipe"]},
    {"space": "辅材", "category": "防水/腻子/石膏", "spec": "东方雨虹", "brands": ["东方雨虹"], "term_slugs": ["waterproofing"]},
    {"space": "其它工程", "category": "垃圾袋/成品保护/竣工保洁", "spec": "含", "brands": [], "term_slugs": []},
    {"space": "售后", "category": "服务承诺", "spec": "十诺 / 14815 / 隐蔽约5年", "brands": [], "term_slugs": ["concealed-works"]}
  ]
}
